Final_Ref_no,Reference
116,"Varol, M., 2019. CO₂ emissions from hydroelectric reservoirs in the Tigris River basin, a semi-arid region of southeastern Turkey. Journal of Hydrology, 569, pp. 782–794."
117,"Paranaíba, J.R., Barros, N., Mendonça, R., Linkhorst, A., Isidorova, A., Roland, F., Almeida, R.M. and Sobek, S., 2018. Spatially resolved measurements of CO₂ and CH4 concentration and gas-exchange velocity highly influence carbon-emission estimates of reservoirs. Environmental science and technology, 52(2), pp. 607–615."
118,"Samiotis, G., Pekridis, G., Kaklidis, N., Trikoilidou, E., Taousanidis, N. and Amanatidou, E., 2018. Greenhouse gas emissions from two hydroelectric reservoirs in Mediterranean region. Environmental monitoring and assessment, 190, pp. 1–13."
119,"Gruca-Rokosz, R., Bartoszek, L. and Koszelnik, P., 2017. The influence of environmental factors on the carbon dioxide flux across the water–air interface of reservoirs in south-eastern Poland. Journal of Environmental Sciences, 56, pp. 290–299."
120,"Yang, M., Grace, J., Geng, X., Guan, L., Zhang, Y., Lei, J., Lu, C. and Lei, G., 2017. Carbon dioxide emissions from the littoral zone of a Chinese reservoir. Water, 9(7), p.539."
121,"Martinez-Cruz, K., Gonzalez-Valencia, R., Sepulveda-Jauregui, A., Plascencia-Hernandez, F., Belmonte-Izquierdo, Y. and Thalasso, F., 2017. Methane emission from aquatic ecosystems of Mexico City. Aquatic Sciences, 79, pp. 159–169."
122,"Gerardo-Nieto, O., Astorga-España, M.S., Mansilla, A. and Thalasso, F., 2017. Initial report on methane and carbon dioxide emission dynamics from sub-Antarctic freshwater ecosystems: A seasonal study of a lake and a reservoir. Science of the Total Environment, 593, pp. 144–154."
123,"DA COSTA, D. O., TANIWAKI, R. H., COELHO, L. H. G., DA SILVA, M. G., DE JESUS, T. A., HANISCH, W. S., DOMINGUES, M. R., POMPÊO, M. L. M. and BENASSI, R. F. 2024. Increased methane emission associated with anthropogenic activities in a highly urbanized tropical reservoir. International Journal of Environmental Science and Technology, 21, 6733-6744."
124,"HUANG, J. and LI, Z. 2023. Carbon emissions affected by real-time reservoir operation: a hydrodynamic modeling approach coupled with air-water mass transfer. Water Research, 241, 120118."
125,"SU, Y., LIU, W., RAHAMAN, M. H., CHEN, Z. and ZHAI, J. 2024. Methane emission from water level fluctuation zone of the Three Gorges Reservoir: Seasonal variation and microbial mechanism. Science of The Total Environment, 912, 168935."
126,"LI, R., FAN, J., ZHAO, W., JIA, Y., XI, N., LI, J., ZHANG, T. and PU, J. 2024. High-frequency dynamics of CO₂ emission flux and its influencing factors in a subtropical karst groundwater-fed reservoir, south China. Environmental Research, 251, 118552."
127,"LENG, P. and KOSCHORRECK, M. 2023. Metabolism and carbonate buffering drive seasonal dynamics of CO₂ emissions from two German reservoirs. Water Research, 242, 120302."
128,"LINKHORST, A., PARANAÍBA, J. R., MENDONÇA, R., RUDBERG, D., DELSONTRO, T., BARROS, N. and SOBEK, S. 2021. Spatially Resolved Measurements in Tropical Reservoirs Reveal Elevated Methane Ebullition at River Inflows and at High Productivity. Global Biogeochemical Cycles, 35, e2020GB006717."
129,"BENASSI, R. F., DE JESUS, T. A., COELHO, L. H. G., HANISCH, W. S., DOMINGUES, M. R., TANIWAKI, R. H., PEDUTO, T. A. G., DA COSTA, D. O., POMPÊO, M. L. M. and MITSCH, W. J. 2021. Eutrophication effects on CH4 and CO₂ fluxes in a highly urbanized tropical reservoir (Southeast, Brazil). Environmental Science and Pollution Research, 28, 42261-42274."
130,"ZHANG, Y., LYU, M., YANG, P., LAI, D. Y. F., TONG, C., ZHAO, G., LI, L., ZHANG, Y. and YANG, H. 2021. Spatial variations in CO₂ fluxes in a subtropical coastal reservoir of Southeast China were related to urbanization and land-use types. Journal of Environmental Sciences, 109, 206-218."
131,"Wu, Y., Mao, X., Xia, L., Tang, W., Yu, H., Zhang, Z., Xiao, F., Ji, H. and Ma, Y. (2024) ’Controlling Methane Ebullition Flux in Cascade Reservoirs of the Upper Yellow River by the Ratio of mcrA to pmoA Genes’, Water (Switzerland), 16(18)."
132,"Bai, X., Xu, Q., Li, H., Cheng, C. and He, Q. (2021) ’Lack of methane hotspot in the upstream dam: Case study in a tributary of the Three Gorges Reservoir, China’, Science of The Total Environment, 754, pp. 142151."
133,"Miller, B. L., Chen, H., He, Y., Yuan, X. and Holtgrieve, G. W. (2019) ’Magnitudes and Drivers of Greenhouse Gas Fluxes in Floodplain Ponds During Drawdown and Inundation by the Three Gorges Reservoir’, Journal of Geophysical Research: Biogeosciences, 124(8), pp. 2499–2517."
134,"Zhang, C. (2018) On the process and mechamism of methane emission from eutrophic ponds (富营养化池塘甲烷排放过程与机制研究 ). Doctor Degree of Environmental Science and Engineering China University of Geosciences."
136,"Yang, F. (2022) The study of production, emission and influence mechanism of methane in cascade reservoirs of Luanhe River Basin (滦河梯级水库CH4产生、排放及影响机制研究). Master of Engineering, Northwest Normal University."
137,"Que, Z. (2023) Spatial and temporal characteristics of CH4 fluxes from small cascade reservoirs. (小型梯级水库甲烷排放特征及影响因素研究). Degree of Master, Chongqing Normal University."
138,"Liu, L., Yang, Z. J., Delwiche, K., Long, L. H., Liu, J., Liu, D. F., Wang, C. F., Bodmer, P. and Lorke, A. (2020) ’Spatial and temporal variability of methane emissions from cascading reservoirs in the Upper Mekong River’, Water Research, 186, pp. 116319."
139,"Soued, C. and Prairie, Y. T. (2020) ’The carbon footprint of a Malaysian tropical reservoir: measured versus modelled estimates highlight the underestimated key role of downstream processes’, Biogeosciences, 17(2), pp. 515–527."
140,"Prairie, Y. T., Mercier-Blais, S., Harrison, J. A., Soued, C., Giorgio, P. d., Harby, A., Alm, J., Chanudet, V. and Nahas, R. (2021) ’A new modelling framework to assess biogenic GHG emissions from reservoirs: The G-res tool’, Environmental Modelling and Software, 143, pp. 105117."
141,"Li, S., Bush, R. T., Santos, I. R., Zhang, Q., Song, K., Mao, R., Wen, Z. and Lu, X. X. (2018) ’Large greenhouse gases emissions from China’s lakes and reservoirs’, Water Research, 147, pp. 13–24."
142,"Gong, C., Yang, X., Tian, M., Su, Y., Li, L., Ran, L., Liu, S., Yu, R., Hu, H. and Lü, X. (2018) ’Variations of CO₂ evasion from reservoirs and its influencing factors in warm season in the headwater region of the Yellow River: A case study of the Liujiaxia Reservoir’, Huanjing Kexue Xuebao/Acta Scientiae Circumstantiae, 38(7), pp. 2919–2930."
143,"Soued, C. and Prairie, Y. T. (2020) ’The carbon footprint of a Malaysian tropical reservoir: measured versus modelled estimates highlight the underestimated key role of downstream processes’, Biogeosciences, 17(2), pp. 515–527."
144,"Descloux, S., Chanudet, V., Serça, D. and Guérin, F. (2017) ’Methane and nitrous oxide annual emissions from an old eutrophic temperate reservoir’, Science of The Total Environment, 598, pp. 959–972."
145,"Lomov, V. A., Frolova, N. L., Efimov, V. A., Repina, I. A., Zhe, L. and Liu, Y. (2024) ’Variability of Methane Content and Fluxes in the Rybinsk Reservoir Based on Field Observations in Different Seasons of the Year’, Izvestiya, Atmospheric and Oceanic Physics, 60(4), pp. 473–489."
146,"Deshmukh, C., Guérin, F., Labat, D., Pighini, S., Vongkhamsao, A., Guédant, P., Rode, W., Godon, A., Chanudet, V., Descloux, S. and Serça, D. (2016) ’Low methane (CH4) emissions downstream of a monomictic subtropical hydroelectric reservoir (Nam Theun 2, Lao PDR)’, Biogeosciences, 13(6), pp. 1919–1932."
147,"Kemenes, A., Forsberg, B. R. and Melack, J. M. (2016) ’Downstream emissions of CH4 and CO₂ from hydroelectric reservoirs (Tucuruí, Samuel, and Curuá-Una) in the Amazon basin’, Inland Waters, 6(3), pp. 295–302."
148,"Kumar, A. and Sharma, M. P. (2016) ’Assessment of risk of GHG emissions from Tehri hydropower reservoir, India’, Human and Ecological Risk Assessment: An International Journal, 22(1), pp. 71–85."
149,"Barros, N. et al. Carbon emission from hydroelectric reservoirs linked to reservoir age and latitude. Nat. Geosci. 4, 593–596 (2011)."
150,"Åberg, J., Bergström, A. K., Algesten, G., Söderback, K., and Jansson, M. (2004). A comparison of the carbon balances of a natural lake (L. Örträsket) and a hydroelectric reservoir (L. Skinnmuddselet) in northern Sweden. Water Research, 38, 531–538."
151,"Chanudet, V., Descloux, S., Harby, A., Sundt, H., Hansen, B. H., Brakstad, O., and Guerin, F. (2011). Gross CO₂ and CH4 emissions from the Nam Ngum and Nam Leuk sub-tropical reservoirs in Lao PDR. Science of the Total Environment, 409(24), 5382–5391."
152,"Okuku EO, Bouillon S, Tole M et al. (2019) Diffusive emissions of methane and nitrous oxide from a cascade of tropical hydropower reservoirs in Kenya. Lakes and Reservoirs: Research and Management, 24, 127-135."
153,"Eugster W, DelSontro T, Sobek S (2011) Eddy covariance flux measurements confirm extreme CH4 emissions from a Swiss hydropower reservoir and resolve their short-term variability. Biogeosciences, 8, 2815-2831."
154,"Liu L, Chen H, Yuan XZ, Chen ZL, Wu YY, 2011a. Unexpected CH4 emission from the Three Gorges Reservoir and its implications. Acta Ecologica Sinica 31, 233-234 (in Chinese with English abstract)."
155,"Prairie, Y. T., Mercier-Blais, S., Harrison, J. A., Soued, C., Giorgio, P. d., Harby, A., Alm, J., Chanudet, V. and Nahas, R. (2021) ’A new modelling framework to assess biogenic GHG emissions from reservoirs: The G-res tool’, Environmental Modelling and Software, 143, pp. 105117."
